title,company,location,posted,link,found_on
Applications Analyst II,Mission Support & Test Services (MSTS),"North Las Vegas, NV, United States","Jun 01, 2026",https://ewij.fa.us8.oraclecloud.com/hcmUI/CandidateExperience/en/sites/CX_2/job/11918,2026-06-01 20:52
Technical Services Analyst,SAIC,"San Diego, CA, United States","Jun 01, 2026",https://eihu.fa.us8.oraclecloud.com/hcmUI/CandidateExperience/en/sites/CX/job/2613158,2026-06-01 21:23
"Analyst, Quality Registered Nurse (RN) PRN",Lifepoint Health,"Athens, TN, United States","Jun 01, 2026",https://ibnjjb.fa.ocs.oraclecloud.com/hcmUI/CandidateExperience/en/sites/CX_1/job/323399,2026-06-01 21:23
Program Specialist - Data Mgmt & Reporting,The Aerospace Corporation,"Phoenix, AZ, United States","Jun 01, 2026",https://icfcjb.fa.ocs.oraclecloud.com/hcmUI/CandidateExperience/en/sites/Aerospace/job/113617,2026-06-01 22:23
"Accreditation and Regulatory Analyst (Onsite, Roseville CA)",Adventist Health,"Roseville, CA, United States","Jun 01, 2026",https://ecvz.fa.us2.oraclecloud.com/hcmUI/CandidateExperience/en/sites/CX_1/job/63582,2026-06-01 23:52
Application Configuration Analyst - Field Mobility Systems,FirstEnergy,"Akron, OH, United States","Jun 02, 2026",https://fa-etjd-saasfaprod1.fa.ocs.oraclecloud.com/hcmUI/CandidateExperience/en/sites/FirstEnergyCareers/job/104069,2026-06-02 12:12
Directors Action Group Project Analyst,SAIC,"El Segundo, CA, United States","Jun 02, 2026",https://eihu.fa.us8.oraclecloud.com/hcmUI/CandidateExperience/en/sites/CX/job/2613182,2026-06-02 12:23
RCS Analyst,IU Health (Indiana University Health),"IN, United States","Jun 02, 2026",https://ekcm.fa.us6.oraclecloud.com/hcmUI/CandidateExperience/en/sites/CX/job/420852,2026-06-02 12:23
"Analyst, Digital Security",Waste Management,"Houston, TX, United States","Jun 02, 2026",https://emcm.fa.us2.oraclecloud.com/hcmUI/CandidateExperience/en/sites/WMCareers/job/2348184,2026-06-02 13:52
Digital Analytics Specialist,Ford Motor Company,"Dearborn, MI, United States","Jun 02, 2026",https://efds.fa.em5.oraclecloud.com/hcmUI/CandidateExperience/en/sites/CX_1/job/61323,2026-06-02 14:43
Full Stack Data Engineer,Ford Motor Company,"Dearborn, MI, United States","Jun 02, 2026",https://efds.fa.em5.oraclecloud.com/hcmUI/CandidateExperience/en/sites/CX_1/job/64882,2026-06-02 14:43
"Asset & Wealth Management, Alternatives Capital Formation, Co-Investment Team, Analyst - NY",Goldman Sachs,"New York, NY, United States","Jun 02, 2026",https://hdpc.fa.us2.oraclecloud.com/hcmUI/CandidateExperience/en/sites/LateralHiring/job/174884,2026-06-02 14:52
"Regional Compliance Analyst (Hybrid - IL, CO, or OH)",Quest Diagnostics,"Denver, CO, United States","Jun 02, 2026",https://hdox.fa.us6.oraclecloud.com/hcmUI/CandidateExperience/en/sites/CX_1/job/57587,2026-06-02 15:03
Live Ranges and Counter Unmanned Aerial Systems (cUAS) Analyst,SAIC,"Arlington, VA, United States","Jun 02, 2026",https://eihu.fa.us8.oraclecloud.com/hcmUI/CandidateExperience/en/sites/CX/job/2613109,2026-06-02 15:23
Data Engineer,Ford Motor Company,"Dearborn, MI, United States","Jun 02, 2026",https://efds.fa.em5.oraclecloud.com/hcmUI/CandidateExperience/en/sites/CX_1/job/63829,2026-06-02 15:43
O&R - Analyst Aide Temp Coops - College Students (Business Majors),Consolidated Edison,"Spring Valley, NY, United States","Jun 02, 2026",https://ejcu.fa.us6.oraclecloud.com/hcmUI/CandidateExperience/en/sites/CX_1035/job/8294,2026-06-02 15:52
"Analyst, Data Management (Salesforce)",Molina Healthcare,United States,"Jun 02, 2026",https://hckd.fa.us2.oraclecloud.com/hcmUI/CandidateExperience/en/sites/CX_1/job/2037509,2026-06-02 16:03
Product Marketing Business Analyst,HealthPartners,"Bloomington, MN, United States","Jun 02, 2026",https://fa-etnv-saasfaprod1.fa.ocs.oraclecloud.com/hcmUI/CandidateExperience/en/sites/healthpartners/job/120479,2026-06-02 16:12
"Specialist, Data Governance",BNY (Bank of New York Mellon),"New York, NY, United States","Jun 02, 2026",https://eofe.fa.us2.oraclecloud.com/hcmUI/CandidateExperience/en/sites/BNY-Careers/job/71211,2026-06-02 17:12
Financial Analyst,Brookdale Senior Living,"Brentwood, TN, United States","Jun 02, 2026",https://ibmwjb.fa.ocs.oraclecloud.com/hcmUI/CandidateExperience/en/sites/CX_1/job/25023453,2026-06-02 17:23
Business Office Analyst,Ford Motor Company,"Dearborn, MI, United States","Jun 02, 2026",https://efds.fa.em5.oraclecloud.com/hcmUI/CandidateExperience/en/sites/CX_1/job/64078,2026-06-02 17:23
"Associate Financial Analyst, Supply Chain",AutoZone,"Memphis, TN, United States","Jun 02, 2026",https://egud.fa.us2.oraclecloud.com/hcmUI/CandidateExperience/en/sites/CX_1/job/111403,2026-06-02 17:34
Data Science Analyst I-FPA Operations,Mount Sinai Health System,United States,"Jun 02, 2026",https://ejis.fa.us6.oraclecloud.com/hcmUI/CandidateExperience/en/sites/CX/job/3038333,2026-06-02 17:52
Data Analyst,Hoffman Construction,"Boise, ID, United States","Jun 02, 2026",https://efsp.fa.us6.oraclecloud.com/hcmUI/CandidateExperience/en/sites/CX/job/1299,2026-06-02 18:23
Mergers & Acquisitions Analyst,Worthington Enterprises,"Columbus, OH, United States","Jun 02, 2026",https://fa-eygo-saasfaprod1.fa.ocs.oraclecloud.com/hcmUI/CandidateExperience/en/sites/CX_2001/job/43193,2026-06-02 18:23
"Vice President, Data Analyst & BI",BNY (Bank of New York Mellon),"Pittsburgh, PA, United States","Jun 02, 2026",https://eofe.fa.us2.oraclecloud.com/hcmUI/CandidateExperience/en/sites/BNY-Careers/job/78210,2026-06-02 18:33
IT Business Systems Analyst II (Customer),Southern Company,"Atlanta, GA, United States","Jun 02, 2026",https://emje.fa.us6.oraclecloud.com/hcmUI/CandidateExperience/en/sites/SouthernCompanyJobs/job/19390,2026-06-02 18:43
Program Analyst,SAIC,"Crane, IN, United States","Jun 02, 2026",https://eihu.fa.us8.oraclecloud.com/hcmUI/CandidateExperience/en/sites/CX/job/2613212,2026-06-02 18:52
Intern - Year Round (Data Quality Engineering),Navy Federal Credit Union,"Vienna, VA, United States","Jun 02, 2026",https://fa-etbx-saasfaprod1.fa.ocs.oraclecloud.com/hcmUI/CandidateExperience/en/sites/nfcu/job/29453,2026-06-02 18:52
Data Engineer II IS - Remote,Providence Health & Services,"Portland, OR, United States","Jun 02, 2026",https://evac.fa.us2.oraclecloud.com/hcmUI/CandidateExperience/en/sites/CX_1/job/430906,2026-06-02 19:23
Logistics Analyst (Transportation & Supply Chain)- TEMP ROLE,At Home,"Coppell, TX, United States","Jun 02, 2026",https://hdiy.fa.us2.oraclecloud.com/hcmUI/CandidateExperience/en/sites/CX/job/22255,2026-06-02 19:23
Value Based Care Data Analyst,HealthPartners,"Bloomington, MN, United States","Jun 02, 2026",https://fa-etnv-saasfaprod1.fa.ocs.oraclecloud.com/hcmUI/CandidateExperience/en/sites/healthpartners/job/118098,2026-06-02 19:43
Assumed Reinsurance Analyst I - Remote,AF Group,United States,"Jun 02, 2026",https://ejko.fa.us2.oraclecloud.com/hcmUI/CandidateExperience/en/sites/CX_5/job/14326,2026-06-02 19:52
Denial Analyst - RN,FMOL Health System,"Baton Rouge, LA, United States","Jun 02, 2026",https://eqtm.fa.us2.oraclecloud.com/hcmUI/CandidateExperience/en/sites/fmolhs-careers/job/48271,2026-06-02 20:43
Applications Analyst - UKG/Kronos,INTEGRIS Health,"Oklahoma City, OK, United States","Jun 02, 2026",https://ertr.fa.us2.oraclecloud.com/hcmUI/CandidateExperience/en/sites/CX_3001/job/112542,2026-06-02 21:03
Systems Analyst 5-Support,Oracle Corporation,"Austin, TX, United States","Jun 02, 2026",https://eeho.fa.us2.oraclecloud.com/hcmUI/CandidateExperience/en/sites/jobsearch/job/335441,2026-06-02 21:12
Asset Analyst,onsemi,"Scottsdale, AZ, United States","Jun 02, 2026",https://hctz.fa.us2.oraclecloud.com/hcmUI/CandidateExperience/en/sites/CX_1001/job/2505647,2026-06-02 21:23
Analyst Global Channel Compliance,onsemi,"Scottsdale, AZ, United States","Jun 02, 2026",https://hctz.fa.us2.oraclecloud.com/hcmUI/CandidateExperience/en/sites/CX_1001/job/2505649,2026-06-02 21:23
"Analyst, Portfolio Valuation",Kroll,"Nashville, TN, United States","Jun 02, 2026",https://hcxs.fa.us2.oraclecloud.com/hcmUI/CandidateExperience/en/sites/CX_1/job/21014327,2026-06-02 21:23
Raley's Pricing Analyst,Raley's,"West Sacramento, CA, United States","Jun 02, 2026",https://fa-epss-saasfaprod1.fa.ocs.oraclecloud.com/hcmUI/CandidateExperience/en/sites/CX_1/job/15680,2026-06-02 21:23
Data Integrity Representative,FMOL Health System,"Baton Rouge, LA, United States","Jun 02, 2026",https://eqtm.fa.us2.oraclecloud.com/hcmUI/CandidateExperience/en/sites/fmolhs-careers/job/48093,2026-06-02 21:23
Data Engineer I IS - Remote,Providence Health & Services,"Renton, WA, United States","Jun 02, 2026",https://evac.fa.us2.oraclecloud.com/hcmUI/CandidateExperience/en/sites/CX_1/job/435996,2026-06-02 22:33
"Analyst I, Marketing Analytics - Corporate (Las Vegas)",Caesars Entertainment,"Las Vegas, NV, United States","Jun 03, 2026",https://edmn.fa.us2.oraclecloud.com/hcmUI/CandidateExperience/en/sites/CX_1/job/85272,2026-06-03 02:23
AI/ML Data Strategist,Perficient,United States,"Jun 03, 2026",https://fa-etqd-saasfaprod1.fa.ocs.oraclecloud.com/hcmUI/CandidateExperience/en/sites/CX_1/job/2026000547,2026-06-03 11:03
Modeling and Simulation Analyst,SAIC,"El Paso, TX, United States","Jun 03, 2026",https://eihu.fa.us8.oraclecloud.com/hcmUI/CandidateExperience/en/sites/CX/job/2613245,2026-06-03 13:03
Analyst - Real Estate,Consolidated Edison,"New York, NY, United States","Jun 03, 2026",https://ejcu.fa.us6.oraclecloud.com/hcmUI/CandidateExperience/en/sites/CX_1035/job/8510,2026-06-03 14:03
"Asset & Wealth Management, Private Family Office Client Analyst - Saratoga Springs",Goldman Sachs,"Albany, NY, United States","Jun 03, 2026",https://hdpc.fa.us2.oraclecloud.com/hcmUI/CandidateExperience/en/sites/LateralHiring/job/175509,2026-06-03 14:03
TS Security Analyst,UL Solutions,"Northbrook, IL, United States","Jun 03, 2026",https://fa-eups-saasfaprod1.fa.ocs.oraclecloud.com/hcmUI/CandidateExperience/en/sites/ULSolutionsCareers/job/9731,2026-06-03 15:12
Engineer / Engineering Analyst (SPC Project Development & Execution),Southern Company,"Birmingham, AL, United States","Jun 03, 2026",https://emje.fa.us6.oraclecloud.com/hcmUI/CandidateExperience/en/sites/SouthernCompanyJobs/job/19411,2026-06-03 15:33
Clinical Research Budgeting Analyst - Clinical Trials - eSIF sent 5/27,Providence Health & Services,"Seattle, WA, United States","Jun 03, 2026",https://evac.fa.us2.oraclecloud.com/hcmUI/CandidateExperience/en/sites/CX_1/job/434763,2026-06-03 15:33
Financial Analyst - Corporate Finance,GM Financial,"Fort Worth, TX, United States","Jun 03, 2026",https://fa-exvu-saasfaprod1.fa.ocs.oraclecloud.com/hcmUI/CandidateExperience/en/sites/CX_1/job/260283,2026-06-03 15:52
Materials Mgmt Analyst I,The Aerospace Corporation,"Clearwater, FL, United States","Jun 03, 2026",https://icfcjb.fa.ocs.oraclecloud.com/hcmUI/CandidateExperience/en/sites/Aerospace/job/113837,2026-06-03 15:52
Maritime Data Exploitation Analyst II,Oceaneering International,"Suitland, MD, United States","Jun 03, 2026",https://ebfr.fa.us2.oraclecloud.com/hcmUI/CandidateExperience/en/sites/jobs/job/10698,2026-06-03 16:52
Materials Management Analyst II (Day Shift),Honeywell,"Geneva, OH, United States","Jun 03, 2026",https://ibqbjb.fa.ocs.oraclecloud.com/hcmUI/CandidateExperience/en/sites/Honeywell/job/147450,2026-06-03 18:23
Application Development & Support Analyst,Vertiv,"Anderson, SC, United States","Jun 03, 2026",https://egup.fa.us2.oraclecloud.com/hcmUI/CandidateExperience/en/sites/CX/job/20270677,2026-06-03 18:33
Cyber Defense Analyst,Ford Motor Company,"Dearborn, MI, United States","Jun 03, 2026",https://efds.fa.em5.oraclecloud.com/hcmUI/CandidateExperience/en/sites/CX_1/job/64098,2026-06-03 18:52
Revenue Analyst,Carnival Corporation,"Miami, FL, United States","Jun 03, 2026",https://eicl.fa.em5.oraclecloud.com/hcmUI/CandidateExperience/en/sites/CORP/job/12939,2026-06-03 19:03
Analyst II/HR Systems (Oracle HCM Functional),Southwest Gas,"Las Vegas, NV, United States","Jun 03, 2026",https://ebtw.fa.us2.oraclecloud.com/hcmUI/CandidateExperience/en/sites/CX_1/job/4138,2026-06-03 19:23
Financial Analyst – Workforce Analytics,Ford Motor Company,"Dearborn, MI, United States","Jun 03, 2026",https://efds.fa.em5.oraclecloud.com/hcmUI/CandidateExperience/en/sites/CX_1/job/64905,2026-06-03 19:23
Financial Analyst,Masimo Corporation,"Irvine, CA, United States","Jun 03, 2026",https://egcu.fa.us6.oraclecloud.com/hcmUI/CandidateExperience/en/sites/CX/job/3859,2026-06-03 19:33
Billing Analyst,StandardAero,"Maryville, TN, United States","Jun 03, 2026",https://cva.fa.us1.oraclecloud.com/hcmUI/CandidateExperience/en/sites/CX_3/job/9481,2026-06-03 19:43
Billing Analyst,StandardAero,"Maryville, TN, United States","Jun 03, 2026",https://cva.fa.us1.oraclecloud.com/hcmUI/CandidateExperience/en/sites/CX_3/job/9578,2026-06-03 19:43
HSV Data Administrative Coordinator,Hilton Grand Vacations,United States,"Jun 03, 2026",https://efuq.fa.us6.oraclecloud.com/hcmUI/CandidateExperience/en/sites/HiltonGrandVacations/job/20261,2026-06-03 19:43
Revenue Cycle Management Vendor Relations Analyst,Envision Healthcare,United States,"Jun 03, 2026",https://eney.fa.us2.oraclecloud.com/hcmUI/CandidateExperience/en/sites/CX_1001/job/1737,2026-06-03 20:03
Logistics Analyst,SAIC,"Crane, IN, United States","Jun 03, 2026",https://eihu.fa.us8.oraclecloud.com/hcmUI/CandidateExperience/en/sites/CX/job/2613288,2026-06-03 20:23
Project Controls Analyst,Stantec,"Charleston, SC, United States","Jun 03, 2026",https://hdhl.fa.us6.oraclecloud.com/hcmUI/CandidateExperience/en/sites/CX_1/job/1006170,2026-06-03 20:52
Cost Analyst SME,SAIC,"Huntsville, AL, United States","Jun 03, 2026",https://eihu.fa.us8.oraclecloud.com/hcmUI/CandidateExperience/en/sites/CX/job/2613301,2026-06-03 21:23
Full Stack Data Engineer,Ford Motor Company,"Dearborn, MI, United States","Jun 03, 2026",https://efds.fa.em5.oraclecloud.com/hcmUI/CandidateExperience/en/sites/CX_1/job/64536,2026-06-03 21:23
Data Analyst,Vertiv,"Pelzer, SC, United States","Jun 03, 2026",https://egup.fa.us2.oraclecloud.com/hcmUI/CandidateExperience/en/sites/CX/job/20274209,2026-06-03 21:43
Data Entry Representative II (SP),Quest Diagnostics,"Houston, MO, United States","Jun 03, 2026",https://hdox.fa.us6.oraclecloud.com/hcmUI/CandidateExperience/en/sites/CX_1/job/61507,2026-06-03 21:52
IT Business Systems Analyst,Oceaneering International,"Houston, TX, United States","Jun 03, 2026",https://ebfr.fa.us2.oraclecloud.com/hcmUI/CandidateExperience/en/sites/jobs/job/10525,2026-06-03 22:12
"Vice President, On-Property Analytics - Corporate (Las Vegas)",Caesars Entertainment,"Las Vegas, NV, United States","Jun 03, 2026",https://edmn.fa.us2.oraclecloud.com/hcmUI/CandidateExperience/en/sites/CX_1/job/85310,2026-06-03 23:33
Benefits Analyst,UCSF (University of California San Francisco),"San Francisco, CA, United States","Jun 03, 2026",https://iazuqy.fa.ocs.oraclecloud.com/hcmUI/CandidateExperience/en/sites/CX_1/job/3770,2026-06-03 23:43
Intelligence Analyst,SAIC,"Sterling, VA, United States","Jun 04, 2026",https://eihu.fa.us8.oraclecloud.com/hcmUI/CandidateExperience/en/sites/CX/job/2613316,2026-06-04 11:03
Junior Intelligence Analyst,SAIC,"Chantilly, VA, United States","Jun 04, 2026",https://eihu.fa.us8.oraclecloud.com/hcmUI/CandidateExperience/en/sites/CX/job/2613315,2026-06-04 11:03
Financial Analyst-Psychiatry - ISM,Mount Sinai Health System,United States,"Jun 04, 2026",https://ejis.fa.us6.oraclecloud.com/hcmUI/CandidateExperience/en/sites/CX/job/3038896,2026-06-04 11:03
Procurement Analyst,SAIC,"San Diego, CA, United States","Jun 04, 2026",https://eihu.fa.us8.oraclecloud.com/hcmUI/CandidateExperience/en/sites/CX/job/2613323,2026-06-04 13:23
"Data System Support Analyst - Plant IT - Papillion Foods (Papillion, NE)",Hormel Foods,"Papillion, NE, United States","Jun 04, 2026",https://ekkh.fa.us2.oraclecloud.com/hcmUI/CandidateExperience/en/sites/CX_2002/job/34342,2026-06-04 13:23
AI Engineer,SAIC,"Remote Work, VA, United States","Jun 04, 2026",https://eihu.fa.us8.oraclecloud.com/hcmUI/CandidateExperience/en/sites/CX/job/2613013,2026-06-04 13:52
"HCM - New York - Vice President, Data Engineering - 9414195",Goldman Sachs,"New York, NY, United States","Jun 04, 2026",https://hdpc.fa.us2.oraclecloud.com/hcmUI/CandidateExperience/en/sites/LateralHiring/job/175647,2026-06-04 14:03
CORP CAPM/FINANCIAL ANALYST 1,Kroger,"Cincinnati, OH, United States","Jun 04, 2026",https://eluq.fa.us2.oraclecloud.com/hcmUI/CandidateExperience/en/sites/CX_2001/job/198270,2026-06-04 14:33
Data Analyst – E-Commerce & Martech,ADT,"Irving, TX, United States","Jun 04, 2026",https://fa-erqb-saasfaprod1.fa.ocs.oraclecloud.com/hcmUI/CandidateExperience/en/sites/CX_1/job/3020662,2026-06-04 15:12
"Research Analyst - Medical Management, Remote",Providence Health & Services,"Portland, OR, United States","Jun 04, 2026",https://evac.fa.us2.oraclecloud.com/hcmUI/CandidateExperience/en/sites/CX_1/job/438169,2026-06-04 15:43
Production Support Analyst,SAIC,"Arlington, VA, United States","Jun 04, 2026",https://eihu.fa.us8.oraclecloud.com/hcmUI/CandidateExperience/en/sites/CX/job/2613343,2026-06-04 15:52
Legal Program Support Analyst,SAIC,"Washington, DC, United States","Jun 04, 2026",https://eihu.fa.us8.oraclecloud.com/hcmUI/CandidateExperience/en/sites/CX/job/2613339,2026-06-04 16:03
Data Distribution Service Developer,SAIC,"Huntsville, AL, United States","Jun 04, 2026",https://eihu.fa.us8.oraclecloud.com/hcmUI/CandidateExperience/en/sites/CX/job/2613347,2026-06-04 16:03
IT Analyst,SAIC,"Washington, DC, United States","Jun 04, 2026",https://eihu.fa.us8.oraclecloud.com/hcmUI/CandidateExperience/en/sites/CX/job/2611109,2026-06-04 16:12
"Corporate Planning & Management, Data Engineering, New York, Associate",Goldman Sachs,"New York, NY, United States","Jun 04, 2026",https://hdpc.fa.us2.oraclecloud.com/hcmUI/CandidateExperience/en/sites/LateralHiring/job/170256,2026-06-04 16:23
Data Analyst – Supply Risk & Automation,Ford Motor Company,"Naucalpan de Juarez, MEX, Mexico","Jun 04, 2026",https://efds.fa.em5.oraclecloud.com/hcmUI/CandidateExperience/en/sites/CX_1/job/64289,2026-06-04 16:33
Analyst RO Business Operations,Hilton Grand Vacations,"Orlando, FL, United States","Jun 04, 2026",https://efuq.fa.us6.oraclecloud.com/hcmUI/CandidateExperience/en/sites/HiltonGrandVacations/job/20074,2026-06-04 16:34
Program Analyst,SAIC,"Arlington, VA, United States","Jun 04, 2026",https://eihu.fa.us8.oraclecloud.com/hcmUI/CandidateExperience/en/sites/CX/job/2613346,2026-06-04 16:52
Data Fusion Center Technician,SAIC,"Camp Smith, HI, United States","Jun 04, 2026",https://eihu.fa.us8.oraclecloud.com/hcmUI/CandidateExperience/en/sites/CX/job/2613348,2026-06-04 16:52
Academic Training Analyst,SAIC,"Virginia Beach, VA, United States","Jun 04, 2026",https://eihu.fa.us8.oraclecloud.com/hcmUI/CandidateExperience/en/sites/CX/job/2613352,2026-06-04 16:52
Sustainability Analyst II,Waste Management,United States,"Jun 04, 2026",https://emcm.fa.us2.oraclecloud.com/hcmUI/CandidateExperience/en/sites/WMCareers/job/2348314,2026-06-04 17:33
IT Support Specialist II (Data),Mission Support & Test Services (MSTS),"Las Vegas, NV, United States","Jun 04, 2026",https://ewij.fa.us8.oraclecloud.com/hcmUI/CandidateExperience/en/sites/CX_2/job/11858,2026-06-04 17:33
Health Plan Claims Analyst I- Environmental Medicine,Mount Sinai Health System,United States,"Jun 04, 2026",https://ejis.fa.us6.oraclecloud.com/hcmUI/CandidateExperience/en/sites/CX/job/3039033,2026-06-04 17:52
Investment Support Analyst,SAIC,"Washington, DC, United States","Jun 04, 2026",https://eihu.fa.us8.oraclecloud.com/hcmUI/CandidateExperience/en/sites/CX/job/2613300,2026-06-04 18:03
Cybersecurity Analyst,SAIC,"Anaheim, CA, United States","Jun 04, 2026",https://eihu.fa.us8.oraclecloud.com/hcmUI/CandidateExperience/en/sites/CX/job/2613358,2026-06-04 18:23
"Asset & Wealth Management, Goldman Sachs Ayco, Wealth Strategies Group, Insurance Product, Analyst, Albany, NY",Goldman Sachs,"Albany, NY, United States","Jun 04, 2026",https://hdpc.fa.us2.oraclecloud.com/hcmUI/CandidateExperience/en/sites/LateralHiring/job/171578,2026-06-04 18:33
Data Engineer I IS - Remote,Providence Health & Services,"Renton, WA, United States","Jun 04, 2026",https://evac.fa.us2.oraclecloud.com/hcmUI/CandidateExperience/en/sites/CX_1/job/432054,2026-06-04 18:52
Actuarial Analyst or Business Analyst,Verisk Analytics,"Jersey City, NJ, United States","Jun 04, 2026",https://fa-ewmy-saasfaprod1.fa.ocs.oraclecloud.com/hcmUI/CandidateExperience/en/sites/CX_1/job/3724,2026-06-04 18:52
"Business Analyst, HR Technology",Arconic,"Pittsburgh, PA, United States","Jun 04, 2026",https://hdnn.fa.us6.oraclecloud.com/hcmUI/CandidateExperience/en/sites/CX/job/113657,2026-06-04 19:03
Lifecycle Cost Analyst,Ford Motor Company,"Dearborn, MI, United States","Jun 04, 2026",https://efds.fa.em5.oraclecloud.com/hcmUI/CandidateExperience/en/sites/CX_1/job/61389,2026-06-04 19:23
Junior Intelligence Analyst,SAIC,"Sterling, VA, United States","Jun 04, 2026",https://eihu.fa.us8.oraclecloud.com/hcmUI/CandidateExperience/en/sites/CX/job/2613373,2026-06-04 19:52
Customer Programs & Solutions Analyst,FirstEnergy,"Akron, OH, United States","Jun 04, 2026",https://fa-etjd-saasfaprod1.fa.ocs.oraclecloud.com/hcmUI/CandidateExperience/en/sites/FirstEnergyCareers/job/103840,2026-06-04 20:03
Healthcare Data Analyst 2,FMOL Health System,"Lafayette, LA, United States","Jun 04, 2026",https://eqtm.fa.us2.oraclecloud.com/hcmUI/CandidateExperience/en/sites/fmolhs-careers/job/48385,2026-06-04 20:12
Accounting Analyst,Ford Motor Company,"Naucalpan de Juarez, MEX, Mexico","Jun 04, 2026",https://efds.fa.em5.oraclecloud.com/hcmUI/CandidateExperience/en/sites/CX_1/job/64545,2026-06-04 20:23
"Analyst, Finance & Analytics (Advanced SQL / Large-Scale Data) - REMOTE",Molina Healthcare,United States,"Jun 04, 2026",https://hckd.fa.us2.oraclecloud.com/hcmUI/CandidateExperience/en/sites/CX_1/job/2037878,2026-06-04 20:33
Program Analyst,SAIC,"Panama City Beach, FL, United States","Jun 04, 2026",https://eihu.fa.us8.oraclecloud.com/hcmUI/CandidateExperience/en/sites/CX/job/2613377,2026-06-04 20:33
Data Services Integration Analyst,SAIC,"Chantilly, VA, United States","Jun 04, 2026",https://eihu.fa.us8.oraclecloud.com/hcmUI/CandidateExperience/en/sites/CX/job/2613378,2026-06-04 20:43
Data Architecture & Information Strategy Engineer,Ford Motor Company,United States,"Jun 04, 2026",https://efds.fa.em5.oraclecloud.com/hcmUI/CandidateExperience/en/sites/CX_1/job/64985,2026-06-04 20:43
Distribution Analyst,Williams-Sonoma,"San Francisco, CA, United States","Jun 04, 2026",https://ehac.fa.us6.oraclecloud.com/hcmUI/CandidateExperience/en/sites/CX_1/job/18850,2026-06-04 21:03
Epic Build Analyst,UCSF (University of California San Francisco),"San Francisco, CA, United States","Jun 04, 2026",https://iazuqy.fa.ocs.oraclecloud.com/hcmUI/CandidateExperience/en/sites/CX_1/job/3408,2026-06-04 21:12
Applications Analyst - ServiceNow/CMDB,INTEGRIS Health,"Oklahoma City, OK, United States","Jun 04, 2026",https://ertr.fa.us2.oraclecloud.com/hcmUI/CandidateExperience/en/sites/CX_3001/job/112991,2026-06-04 21:23
StrataJazz Applications Analyst II- Digital and Technology Partners - Hybrid,Mount Sinai Health System,United States,"Jun 04, 2026",https://ejis.fa.us6.oraclecloud.com/hcmUI/CandidateExperience/en/sites/CX/job/3038434,2026-06-04 21:23
Alert24 Security Risk Analyst,WTW (Willis Towers Watson),"Houston, TX, United States","Jun 04, 2026",https://eedu.fa.em3.oraclecloud.com/hcmUI/CandidateExperience/en/sites/CX_1003/job/202603504,2026-06-04 21:23
Wealth Management Ayco | Analyst | Dallas,Goldman Sachs,"Dallas, TX, United States","Jun 04, 2026",https://hdpc.fa.us2.oraclecloud.com/hcmUI/CandidateExperience/en/sites/LateralHiring/job/162426,2026-06-04 21:33
"Learning Systems Analyst, Full Time, Day Shift",Adventist Health,"Portland, OR, United States","Jun 04, 2026",https://ecvz.fa.us2.oraclecloud.com/hcmUI/CandidateExperience/en/sites/CX_1/job/64877,2026-06-04 21:43
Systems Analyst 1-IT,Oracle Corporation,"Jefferson City, MO, United States","Jun 04, 2026",https://eeho.fa.us2.oraclecloud.com/hcmUI/CandidateExperience/en/sites/jobsearch/job/335325,2026-06-04 22:23
"NA Sales Representatives, Data Platform - Higher Education - Florida",Oracle Corporation,"FL, United States","Jun 04, 2026",https://eeho.fa.us2.oraclecloud.com/hcmUI/CandidateExperience/en/sites/jobsearch/job/335767,2026-06-04 22:23
IT AI ENGINEER,Sally Beauty,"Plano, TX, United States","Jun 04, 2026",https://eigx.fa.us6.oraclecloud.com/hcmUI/CandidateExperience/en/sites/CX_13/job/51070,2026-06-04 23:03
"NA Sales Representative, Data Platform -Healthcare",Oracle Corporation,"Chicago, IL, United States","Jun 04, 2026",https://eeho.fa.us2.oraclecloud.com/hcmUI/CandidateExperience/en/sites/jobsearch/job/335830,2026-06-05 11:03
Information Systems Analyst,Lifepoint Health,"Johnstown, PA, United States","Jun 05, 2026",https://ibnjjb.fa.ocs.oraclecloud.com/hcmUI/CandidateExperience/en/sites/CX_1/job/343954,2026-06-05 11:03
Configuration Management Analyst,SAIC,"Middletown, RI, United States","Jun 05, 2026",https://eihu.fa.us8.oraclecloud.com/hcmUI/CandidateExperience/en/sites/CX/job/2613387,2026-06-05 12:33
Controllers | Analyst | New York / New Jersey,Goldman Sachs,"NY, United States","Jun 05, 2026",https://hdpc.fa.us2.oraclecloud.com/hcmUI/CandidateExperience/en/sites/LateralHiring/job/155254,2026-06-05 13:23
ATM Analyst,Cantor Fitzgerald / BGC,"NY, United States","Jun 05, 2026",https://hdow.fa.us6.oraclecloud.com/hcmUI/CandidateExperience/en/sites/CX_1003/job/248822,2026-06-05 13:33
Clearance & Settlement Analyst,DTCC,"Tampa, FL, United States","Jun 05, 2026",https://ebxr.fa.us2.oraclecloud.com/hcmUI/CandidateExperience/en/sites/CX_1/job/213874,2026-06-05 13:52
