title,company,location,posted,link,found_on
Configuration Analyst,Texas Children's Hospital,"TX, United States","May 16, 2026",https://eohh.fa.us2.oraclecloud.com/hcmUI/CandidateExperience/en/sites/CX/job/424360,2026-05-16 22:52
Provider Installation Analyst,Texas Children's Hospital,"Bellaire, TX, United States","May 15, 2026",https://eohh.fa.us2.oraclecloud.com/hcmUI/CandidateExperience/en/sites/CX/job/424531,2026-05-16 22:52
Payroll Compliance and Operations Analyst,Emerson Electric,"St. Louis, MO, United States","May 15, 2026",https://hdjq.fa.us2.oraclecloud.com/hcmUI/CandidateExperience/en/sites/CX_1/job/26005020,2026-05-16 22:52
"GIS Analyst I, II",Southern Company,"Atlanta, GA, United States","May 15, 2026",https://emje.fa.us6.oraclecloud.com/hcmUI/CandidateExperience/en/sites/SouthernCompanyJobs/job/18991,2026-05-16 22:52
Data Center Thermal Technician,Vertiv,"Reno, NV, United States","May 15, 2026",https://egup.fa.us2.oraclecloud.com/hcmUI/CandidateExperience/en/sites/CX/job/20268910,2026-05-16 22:52
Data Center Facilities Operations Technician V – Mechanical (IC5/OPX),Oracle Corporation,"MI, United States","May 15, 2026",https://eeho.fa.us2.oraclecloud.com/hcmUI/CandidateExperience/en/sites/jobsearch/job/333898,2026-05-16 22:52
Data Center Facilities Operations Technician II - Mechanical (IC2/OP3),Oracle Corporation,"MI, United States","May 15, 2026",https://eeho.fa.us2.oraclecloud.com/hcmUI/CandidateExperience/en/sites/jobsearch/job/333900,2026-05-16 22:52
Data Center Facilities Operations Technician II - General (IC2/OP3),Oracle Corporation,"MI, United States","May 15, 2026",https://eeho.fa.us2.oraclecloud.com/hcmUI/CandidateExperience/en/sites/jobsearch/job/333902,2026-05-16 22:52
Data Center Facilities Operations Technician V - General (IC5/OPX),Oracle Corporation,"MI, United States","May 15, 2026",https://eeho.fa.us2.oraclecloud.com/hcmUI/CandidateExperience/en/sites/jobsearch/job/333905,2026-05-16 22:52
Data Center Facilities Operations Technician II - Electrical (IC2/OP3),Oracle Corporation,"MI, United States","May 15, 2026",https://eeho.fa.us2.oraclecloud.com/hcmUI/CandidateExperience/en/sites/jobsearch/job/333906,2026-05-16 22:52
Data Center Facilities Operations Technician V – Electrical (IC5/OPX),Oracle Corporation,"MI, United States","May 15, 2026",https://eeho.fa.us2.oraclecloud.com/hcmUI/CandidateExperience/en/sites/jobsearch/job/333911,2026-05-16 22:52
Data Center Technician-3,Oracle Corporation,"Phoenix, AZ, United States","May 15, 2026",https://eeho.fa.us2.oraclecloud.com/hcmUI/CandidateExperience/en/sites/jobsearch/job/314730,2026-05-16 22:52
Global Engineering Operations Analyst,Oracle Corporation,"Nashville, TN, United States","May 15, 2026",https://eeho.fa.us2.oraclecloud.com/hcmUI/CandidateExperience/en/sites/jobsearch/job/333961,2026-05-16 22:52
Resource Analyst,Oracle Corporation,United States,"May 15, 2026",https://eeho.fa.us2.oraclecloud.com/hcmUI/CandidateExperience/en/sites/jobsearch/job/333994,2026-05-16 22:52
Data Quality Specialist,UW Health,"Madison, WI, United States","May 15, 2026",https://eimy.fa.us6.oraclecloud.com/hcmUI/CandidateExperience/en/sites/CX_1/job/47952,2026-05-16 22:52
Operations Analyst,Waste Management,"Lodi, CA, United States","May 15, 2026",https://emcm.fa.us2.oraclecloud.com/hcmUI/CandidateExperience/en/sites/WMCareers/job/2347130,2026-05-16 22:52
"Analyst II, Audit",Waste Management,"Houston, TX, United States","May 15, 2026",https://emcm.fa.us2.oraclecloud.com/hcmUI/CandidateExperience/en/sites/WMCareers/job/2347412,2026-05-16 22:52
Risk Analyst - Portfolio Forecasting,GM Financial,"Fort Worth, TX, United States","May 15, 2026",https://fa-exvu-saasfaprod1.fa.ocs.oraclecloud.com/hcmUI/CandidateExperience/en/sites/CX_1/job/260142,2026-05-16 22:52
Risk Analyst II - Credit Risk Analytics,GM Financial,"Irving, TX, United States","May 15, 2026",https://fa-exvu-saasfaprod1.fa.ocs.oraclecloud.com/hcmUI/CandidateExperience/en/sites/CX_1/job/260168,2026-05-16 22:52
MFG Data Scientist,Texas Instruments,"Richardson, TX, United States","May 15, 2026",https://edbz.fa.us2.oraclecloud.com/hcmUI/CandidateExperience/en/sites/CX/job/25010778,2026-05-16 22:52
Program Human Resources Analyst,SAIC,"Chantilly, VA, United States","May 16, 2026",https://eihu.fa.us8.oraclecloud.com/hcmUI/CandidateExperience/en/sites/CX/job/2612652,2026-05-16 22:52
UTEP or NMSU Software Engineer Intern,SAIC,"El Paso, TX, United States","May 15, 2026",https://eihu.fa.us8.oraclecloud.com/hcmUI/CandidateExperience/en/sites/CX/job/2612002,2026-05-16 22:52
"Applied AI Engineer, Global Banking & Markets, New York City",Goldman Sachs,"New York, NY, United States","May 15, 2026",https://hdpc.fa.us2.oraclecloud.com/hcmUI/CandidateExperience/en/sites/LateralHiring/job/155460,2026-05-16 22:52
"Corporate Treasury, Liquidity Risk, AI Engineer, Vice President, Dallas",Goldman Sachs,"Dallas, TX, United States","May 15, 2026",https://hdpc.fa.us2.oraclecloud.com/hcmUI/CandidateExperience/en/sites/LateralHiring/job/170576,2026-05-16 22:52
Finance Analyst – Costing,Honeywell,"Charlotte, NC, United States","May 15, 2026",https://ibqbjb.fa.ocs.oraclecloud.com/hcmUI/CandidateExperience/en/sites/Honeywell/job/148261,2026-05-16 22:52
Finance Analyst - Working Capital & Free Cash Flow,Honeywell,"Charlotte, NC, United States","May 15, 2026",https://ibqbjb.fa.ocs.oraclecloud.com/hcmUI/CandidateExperience/en/sites/Honeywell/job/148262,2026-05-16 22:52
Software Engineer I,Honeywell,"Hamilton, NJ, United States","May 15, 2026",https://ibqbjb.fa.ocs.oraclecloud.com/hcmUI/CandidateExperience/en/sites/Honeywell/job/148391,2026-05-16 22:52
Advanced Software Engineer - Cybersecurity,Honeywell,"Duluth, GA, United States","May 15, 2026",https://ibqbjb.fa.ocs.oraclecloud.com/hcmUI/CandidateExperience/en/sites/Honeywell/job/148705,2026-05-16 22:52
"Analyst, Compliance Consulting",Kroll,"New York, NY, United States","May 15, 2026",https://hcxs.fa.us2.oraclecloud.com/hcmUI/CandidateExperience/en/sites/CX_1/job/21014135,2026-05-16 22:52
Medical Coding Quality Analyst (Remote),Lifepoint Health,"Brentwood, TN, United States","May 15, 2026",https://ibnjjb.fa.ocs.oraclecloud.com/hcmUI/CandidateExperience/en/sites/CX_1/job/342173,2026-05-16 22:52
Interim Finance Analyst – Financial Modeling,Conduent,"Atlanta, GA, United States","May 15, 2026",https://egua.fa.us2.oraclecloud.com/hcmUI/CandidateExperience/en/sites/CX_1/job/23058,2026-05-16 22:52
Environmental Data & Reporting Engineer,Worthington Steel,"Columbus, OH, United States","May 15, 2026",https://cbdt.fa.us2.oraclecloud.com/hcmUI/CandidateExperience/en/sites/WorthingtonSteelCareers/job/43066,2026-05-16 22:52
"26-27 Accountability and Data Reporting: Data Analyst, Accountability and Research",Arizona Public Service (APS),"Aurora, CO, United States","May 15, 2026",https://fa-epop-saasfaprod1.fa.ocs.oraclecloud.com/hcmUI/CandidateExperience/en/sites/CX_1/job/258361,2026-05-16 22:52
Reporting Analyst,Providence Health & Services,"Portland, OR, United States","May 15, 2026",https://evac.fa.us2.oraclecloud.com/hcmUI/CandidateExperience/en/sites/CX_1/job/428496,2026-05-16 22:52
Payroll Analyst,Clean Harbors,"Norwell, MA, United States","May 15, 2026",https://epyc.fa.us2.oraclecloud.com/hcmUI/CandidateExperience/en/sites/CLH-US/job/160657,2026-05-16 22:52
Accounts Receivable Analyst - Non-Government,UCSF (University of California San Francisco),"Emeryville, CA, United States","May 15, 2026",https://iazuqy.fa.ocs.oraclecloud.com/hcmUI/CandidateExperience/en/sites/CX_1/job/2126,2026-05-16 22:52
RSCH DATA ANL 1 RP,UCSF (University of California San Francisco),"San Francisco, CA, United States","May 15, 2026",https://iazuqy.fa.ocs.oraclecloud.com/hcmUI/CandidateExperience/en/sites/CX_1/job/2157,2026-05-16 22:52
Data Scientist,UCSF (University of California San Francisco),"San Francisco, CA, United States","May 15, 2026",https://iazuqy.fa.ocs.oraclecloud.com/hcmUI/CandidateExperience/en/sites/CX_1/job/2516,2026-05-16 22:52
Health Information Analyst  II,HealthPartners,"Saint Paul, MN, United States","May 15, 2026",https://fa-etnv-saasfaprod1.fa.ocs.oraclecloud.com/hcmUI/CandidateExperience/en/sites/healthpartners/job/119777,2026-05-16 22:52
Health Information Analyst  II,HealthPartners,"Saint Paul, MN, United States","May 15, 2026",https://fa-etnv-saasfaprod1.fa.ocs.oraclecloud.com/hcmUI/CandidateExperience/en/sites/healthpartners/job/119822,2026-05-16 22:52
Financial Analyst II,Atlantic Health System,"Morristown, NJ, United States","May 15, 2026",https://erqh.fa.us2.oraclecloud.com/hcmUI/CandidateExperience/en/sites/CX_1001/job/28326,2026-05-16 22:52
B2B Integration Analyst,Hub Group,"Oak Brook, IL, United States","May 15, 2026",https://hdat.fa.us2.oraclecloud.com/hcmUI/CandidateExperience/en/sites/CX/job/11200,2026-05-16 22:52
Compensation Analyst,Adventist Health,"Roseville, CA, United States","May 15, 2026",https://ecvz.fa.us2.oraclecloud.com/hcmUI/CandidateExperience/en/sites/CX_1/job/62993,2026-05-16 22:52
Social Listening Analyst,Carnival Corporation,"Fort Lauderdale, FL, United States","May 15, 2026",https://eicl.fa.em5.oraclecloud.com/hcmUI/CandidateExperience/en/sites/CORP/job/13111,2026-05-16 22:52
Manufacturing PLM System Analyst,Ford Motor Company,"Dearborn, MI, United States","May 15, 2026",https://efds.fa.em5.oraclecloud.com/hcmUI/CandidateExperience/en/sites/CX_1/job/62229,2026-05-16 22:53
Credit Bureau Analyst,Ford Motor Company,United States,"May 15, 2026",https://efds.fa.em5.oraclecloud.com/hcmUI/CandidateExperience/en/sites/CX_1/job/63185,2026-05-16 22:53
Constraints Analyst,Ford Motor Company,"Dearborn, MI, United States","May 15, 2026",https://efds.fa.em5.oraclecloud.com/hcmUI/CandidateExperience/en/sites/CX_1/job/63435,2026-05-16 22:53
Embedded Software Engineer (IVI Infrastructure) - Student Worker Program,Ford Motor Company,"Palo Alto, CA, United States","May 15, 2026",https://efds.fa.em5.oraclecloud.com/hcmUI/CandidateExperience/en/sites/CX_1/job/63881,2026-05-16 22:53
Software Engineer,Ford Motor Company,"Dearborn, MI, United States","May 15, 2026",https://efds.fa.em5.oraclecloud.com/hcmUI/CandidateExperience/en/sites/CX_1/job/64003,2026-05-16 22:53
MBS Software Engineer,Ford Motor Company,"Dearborn, MI, United States","May 15, 2026",https://efds.fa.em5.oraclecloud.com/hcmUI/CandidateExperience/en/sites/CX_1/job/64019,2026-05-16 22:53
IT Analyst I,The Aerospace Corporation,"Phoenix, AZ, United States","May 15, 2026",https://icfcjb.fa.ocs.oraclecloud.com/hcmUI/CandidateExperience/en/sites/Aerospace/job/112151,2026-05-16 22:53
Quality Analyst,Marriott International,"Nashville, TN, United States","May 15, 2026",https://ejwl.fa.us2.oraclecloud.com/hcmUI/CandidateExperience/en/sites/CX/job/26059884,2026-05-16 22:53
Gen Operations Analyst,Berkshire Hathaway Energy (BHE),"Las Vegas, NV, United States","May 18, 2026",https://fa-essf-saasfaprod1.fa.ocs.oraclecloud.com/hcmUI/CandidateExperience/en/sites/CX_1/job/10004872,2026-05-18 11:03
Capacity Planning Analyst,Ford Motor Company,"Dearborn, MI, United States","May 18, 2026",https://efds.fa.em5.oraclecloud.com/hcmUI/CandidateExperience/en/sites/CX_1/job/63376,2026-05-18 11:03
"Data Analyst, Audit",Sherwin-Williams,"Cleveland, OH, United States","May 18, 2026",https://ejhp.fa.us6.oraclecloud.com/hcmUI/CandidateExperience/en/sites/CX_2/job/2610709,2026-05-18 11:52
EHR Applications Analyst,The Christ Hospital Health Network,"OH, United States","May 18, 2026",https://fa-etxt-saasfaprod1.fa.ocs.oraclecloud.com/hcmUI/CandidateExperience/en/sites/CX_5/job/13933,2026-05-18 12:23
Treasury Analyst,WTW (Willis Towers Watson),"Madrid, Comunidad de Madrid, Spain","May 18, 2026",https://eedu.fa.em3.oraclecloud.com/hcmUI/CandidateExperience/en/sites/CX_1003/job/202603302,2026-05-18 12:52
Data Entry Associate,Conduent,"Plano, TX, United States","May 18, 2026",https://egua.fa.us2.oraclecloud.com/hcmUI/CandidateExperience/en/sites/CX_1/job/23043,2026-05-18 13:03
"Marcus by Goldman Sachs - Vendor Relationship Management - Analyst, Richardson, TX/Draper, UT",Goldman Sachs,"Draper, UT, United States","May 18, 2026",https://hdpc.fa.us2.oraclecloud.com/hcmUI/CandidateExperience/en/sites/LateralHiring/job/172986,2026-05-18 13:23
"Applied AI Engineer, Global Banking & Markets, Front Office Technology",Goldman Sachs,"New York, NY, United States","May 18, 2026",https://hdpc.fa.us2.oraclecloud.com/hcmUI/CandidateExperience/en/sites/LateralHiring/job/170004,2026-05-18 13:33
Strategic Analyst – Semiconductor Account,ABM Industries,"Austin, TX, United States","May 18, 2026",https://eiqg.fa.us2.oraclecloud.com/hcmUI/CandidateExperience/en/sites/CX_1001/job/154385,2026-05-18 13:43
Associate Business Analyst - Customer Care Support - Fairmont Corporate Center,FirstEnergy,"Fairmont, WV, United States","May 18, 2026",https://fa-etjd-saasfaprod1.fa.ocs.oraclecloud.com/hcmUI/CandidateExperience/en/sites/FirstEnergyCareers/job/104323,2026-05-18 13:52
"Asset & Wealth Management, Fund Management, Analyst - New York",Goldman Sachs,"New York, NY, United States","May 18, 2026",https://hdpc.fa.us2.oraclecloud.com/hcmUI/CandidateExperience/en/sites/LateralHiring/job/173917,2026-05-18 14:03
Health Plan Claims Analyst II-Selikoff Centers for Occupational Health,Mount Sinai Health System,United States,"May 18, 2026",https://ejis.fa.us6.oraclecloud.com/hcmUI/CandidateExperience/en/sites/CX/job/3038199,2026-05-18 14:03
Epic Clinical Business Intelligence Analyst - Intermediate (On-Site),UT Health San Antonio,"San Antonio, TX, United States","May 18, 2026",https://fa-eomf-saasfaprod1.fa.ocs.oraclecloud.com/hcmUI/CandidateExperience/en/sites/CX_1002/job/6963,2026-05-18 14:23
Subcontracts Analyst,SAIC,"Remote Work, IN, United States","May 18, 2026",https://eihu.fa.us8.oraclecloud.com/hcmUI/CandidateExperience/en/sites/CX/job/2612540,2026-05-18 14:52
Program Analyst,SAIC,"Crane, IN, United States","May 18, 2026",https://eihu.fa.us8.oraclecloud.com/hcmUI/CandidateExperience/en/sites/CX/job/2612678,2026-05-18 15:03
Systems Analyst Hourly - Onsite,Community Health Systems (CHS),"Key West, FL, United States","May 18, 2026",https://fa-evxo-saasfaprod1.fa.ocs.oraclecloud.com/hcmUI/CandidateExperience/en/sites/CX_1/job/152522,2026-05-18 15:03
Data Entry Clerk II - FT - Days,Community Health Systems (CHS),"Oro Valley, AZ, United States","May 18, 2026",https://fa-evxo-saasfaprod1.fa.ocs.oraclecloud.com/hcmUI/CandidateExperience/en/sites/CX_1/job/152780,2026-05-18 15:03
Business Operations Data Analyst,WTW (Willis Towers Watson),"Madrid, Comunidad de Madrid, Spain","May 18, 2026",https://eedu.fa.em3.oraclecloud.com/hcmUI/CandidateExperience/en/sites/CX_1003/job/202603443,2026-05-18 15:03
Financial Systems Analyst,Atlantic Health System,"Morristown, NJ, United States","May 18, 2026",https://erqh.fa.us2.oraclecloud.com/hcmUI/CandidateExperience/en/sites/CX_1001/job/26301,2026-05-18 15:33
Transmission Analyst (Schedule Analyst),Southern Company,"Birmingham, AL, United States","May 18, 2026",https://emje.fa.us6.oraclecloud.com/hcmUI/CandidateExperience/en/sites/SouthernCompanyJobs/job/19114,2026-05-18 16:03
Transmission Analyst (Cost Analyst),Southern Company,"Birmingham, AL, United States","May 18, 2026",https://emje.fa.us6.oraclecloud.com/hcmUI/CandidateExperience/en/sites/SouthernCompanyJobs/job/19115,2026-05-18 16:03
Analyst Reporting Revenue,Hilton Grand Vacations,"Las Vegas, NV, United States","May 18, 2026",https://efuq.fa.us6.oraclecloud.com/hcmUI/CandidateExperience/en/sites/HiltonGrandVacations/job/19223,2026-05-18 16:03
Business Transform Analyst II,Navy Federal Credit Union,"Vienna, VA, United States","May 18, 2026",https://fa-etbx-saasfaprod1.fa.ocs.oraclecloud.com/hcmUI/CandidateExperience/en/sites/nfcu/job/30287,2026-05-18 16:23
"Asset & Wealth Management, Private Wealth Management, Wealth Management Analyst - Philadelphia",Goldman Sachs,"Philadelphia, PA, United States","May 18, 2026",https://hdpc.fa.us2.oraclecloud.com/hcmUI/CandidateExperience/en/sites/LateralHiring/job/164207,2026-05-18 16:33
"Asset & Wealth Management, Operations MI Analyst, Associate, Dublin",Goldman Sachs,"Dublin, Co. Dublin, Ireland","May 18, 2026",https://hdpc.fa.us2.oraclecloud.com/hcmUI/CandidateExperience/en/sites/LateralHiring/job/165692,2026-05-18 16:33
CORPORATE FINANCIAL ANALYST G&A,Envision Healthcare,"Dallas, TX, United States","May 18, 2026",https://eney.fa.us2.oraclecloud.com/hcmUI/CandidateExperience/en/sites/CX_1001/job/1686,2026-05-18 16:33
Dealer Services Analyst (P- TN),Ford Motor Company,"Nashville, TN, United States","May 18, 2026",https://efds.fa.em5.oraclecloud.com/hcmUI/CandidateExperience/en/sites/CX_1/job/63536,2026-05-18 16:52
MP&L Program Analyst,Ford Motor Company,"Dearborn, MI, United States","May 18, 2026",https://efds.fa.em5.oraclecloud.com/hcmUI/CandidateExperience/en/sites/CX_1/job/63626,2026-05-18 16:52
"Asset & Wealth Management, XIG, Platform Management - Hedge Funds, Investment Onboarding & Structuring , Analyst - West Palm Beach",Goldman Sachs,"West Palm Beach, FL, United States","May 18, 2026",https://hdpc.fa.us2.oraclecloud.com/hcmUI/CandidateExperience/en/sites/LateralHiring/job/171620,2026-05-18 17:23
Product Support Analyst,Computershare,"Edison, NJ, United States","May 18, 2026",https://fa-evdq-saasfaprod1.fa.ocs.oraclecloud.com/hcmUI/CandidateExperience/en/sites/computersharecareers/job/9388,2026-05-18 17:43
IT Platform Engineer-Analytics Services,Ford Motor Company,"MI, United States","May 18, 2026",https://efds.fa.em5.oraclecloud.com/hcmUI/CandidateExperience/en/sites/CX_1/job/63703,2026-05-18 17:43
"Sales Engineer, Data Centers",Clean Harbors,"Austin, TX, United States","May 18, 2026",https://epyc.fa.us2.oraclecloud.com/hcmUI/CandidateExperience/en/sites/CLH-US/job/160977,2026-05-18 17:52
"Sales Engineer, Data Centers",Clean Harbors,"Prince George, VA, United States","May 18, 2026",https://epyc.fa.us2.oraclecloud.com/hcmUI/CandidateExperience/en/sites/CLH-US/job/161013,2026-05-18 18:03
Inventory and Data Entry Associate,Cherokee Nation Businesses,"Tahlequah, OK, United States","May 18, 2026",https://ejvp.fa.us2.oraclecloud.com/hcmUI/CandidateExperience/en/sites/CX_1/job/31059,2026-05-18 18:03
Analyst Clinical Documentation Integrity (CDI),Envision Healthcare,United States,"May 18, 2026",https://eney.fa.us2.oraclecloud.com/hcmUI/CandidateExperience/en/sites/CX_1001/job/1713,2026-05-18 18:12
IT Business Systems Analyst,GuideWell (Florida Blue),United States,"May 18, 2026",https://fa-etum-saasfaprod1.fa.ocs.oraclecloud.com/hcmUI/CandidateExperience/en/sites/CX_1/job/41476,2026-05-18 18:23
Data Scientist I,Verisk Analytics,"Boston, MA, United States","May 18, 2026",https://fa-ewmy-saasfaprod1.fa.ocs.oraclecloud.com/hcmUI/CandidateExperience/en/sites/CX_1/job/3746,2026-05-18 18:23
Investment Consulting Analyst,WTW (Willis Towers Watson),"New York, NY, United States","May 18, 2026",https://eedu.fa.em3.oraclecloud.com/hcmUI/CandidateExperience/en/sites/CX_1003/job/202602687,2026-05-18 18:33
AI Solutions Analyst,Southern Company,"Atlanta, GA, United States","May 18, 2026",https://emje.fa.us6.oraclecloud.com/hcmUI/CandidateExperience/en/sites/SouthernCompanyJobs/job/18898,2026-05-18 18:43
Application Analyst 2,FMOL Health System,"Baton Rouge, LA, United States","May 18, 2026",https://eqtm.fa.us2.oraclecloud.com/hcmUI/CandidateExperience/en/sites/fmolhs-careers/job/46774,2026-05-18 18:52
Offensive Security Analyst,Southern Company,"Birmingham, AL, United States","May 18, 2026",https://emje.fa.us6.oraclecloud.com/hcmUI/CandidateExperience/en/sites/SouthernCompanyJobs/job/19101,2026-05-18 19:03
"Analyst, Cyber Threat",Lifepoint Health,"Brentwood, TN, United States","May 18, 2026",https://ibnjjb.fa.ocs.oraclecloud.com/hcmUI/CandidateExperience/en/sites/CX_1/job/339102,2026-05-18 19:23
Data Engineer / Analytics Engineer – People Analytics,Omnicell,"Austin, TX, United States","May 18, 2026",https://elrj.fa.us2.oraclecloud.com/hcmUI/CandidateExperience/en/sites/CX_1001/job/5257,2026-05-18 19:23
Inventory and Data Entry Associate,Cherokee Nation Businesses,"West Siloam Springs, OK, United States","May 18, 2026",https://ejvp.fa.us2.oraclecloud.com/hcmUI/CandidateExperience/en/sites/CX_1/job/31362,2026-05-18 19:52
"Mgr, Product Dev & Analytics",Southern Company,"Atlanta, GA, United States","May 18, 2026",https://emje.fa.us6.oraclecloud.com/hcmUI/CandidateExperience/en/sites/SouthernCompanyJobs/job/19129,2026-05-18 20:03
Data Scientist,SAIC,"Huntsville, AL, United States","May 18, 2026",https://eihu.fa.us8.oraclecloud.com/hcmUI/CandidateExperience/en/sites/CX/job/2612710,2026-05-18 20:12
Business Analyst,Quest Diagnostics,"Schaumburg, IL, United States","May 18, 2026",https://hdox.fa.us6.oraclecloud.com/hcmUI/CandidateExperience/en/sites/CX_1/job/59939,2026-05-18 20:23
"Analyst, Compliance (Business Analyst)",Molina Healthcare,United States,"May 18, 2026",https://hckd.fa.us2.oraclecloud.com/hcmUI/CandidateExperience/en/sites/CX_1/job/2037504,2026-05-18 21:03
"Asset & Wealth Management, Operational Risk, Analyst - Dallas",Goldman Sachs,"Dallas, TX, United States","May 18, 2026",https://hdpc.fa.us2.oraclecloud.com/hcmUI/CandidateExperience/en/sites/LateralHiring/job/163297,2026-05-18 21:03
AI Data Engineer,SAIC,"Fort Belvoir, VA, United States","May 18, 2026",https://eihu.fa.us8.oraclecloud.com/hcmUI/CandidateExperience/en/sites/CX/job/2612714,2026-05-18 21:12
Epic Professional Billing Analyst – Associate,UT Health San Antonio,"San Antonio, TX, United States","May 18, 2026",https://fa-eomf-saasfaprod1.fa.ocs.oraclecloud.com/hcmUI/CandidateExperience/en/sites/CX_1002/job/6970,2026-05-18 21:23
"Associate Analyst, Actuarial - REMOTE",Molina Healthcare,United States,"May 18, 2026",https://hckd.fa.us2.oraclecloud.com/hcmUI/CandidateExperience/en/sites/CX_1/job/2037423,2026-05-18 23:33
Digital Supplier Experience Analyst,Ford Motor Company,"Dearborn, MI, United States","May 19, 2026",https://efds.fa.em5.oraclecloud.com/hcmUI/CandidateExperience/en/sites/CX_1/job/61188,2026-05-19 11:03
Product Data Analyst - Digital Analytics,Hearst,"Washington, DC, United States","May 19, 2026",https://eevd.fa.us6.oraclecloud.com/hcmUI/CandidateExperience/en/sites/CX/job/2026770,2026-05-19 12:52
Financial Analyst,Lifepoint Health,"Warrenton, VA, United States","May 19, 2026",https://ibnjjb.fa.ocs.oraclecloud.com/hcmUI/CandidateExperience/en/sites/CX_1/job/341896,2026-05-19 13:23
EPIC Analyst-Level 3 - IT EPIC Clinical - Full Time,Guthrie Healthcare,United States,"May 19, 2026",https://elfw.fa.us2.oraclecloud.com/hcmUI/CandidateExperience/en/sites/CX_1001/job/22206,2026-05-19 13:43
Inventory Control Analyst,Cummins,"SC, United States","May 19, 2026",https://fa-espx-saasfaprod1.fa.ocs.oraclecloud.com/hcmUI/CandidateExperience/en/sites/CX_1/job/2429753,2026-05-19 14:03
Revenue Management Analyst,Marriott International,"Grapevine, TX, United States","May 19, 2026",https://ejwl.fa.us2.oraclecloud.com/hcmUI/CandidateExperience/en/sites/CX/job/26060124,2026-05-19 14:04
Vehicle Supply Base Capacity  Planning Analyst,Ford Motor Company,"Dearborn, MI, United States","May 19, 2026",https://efds.fa.em5.oraclecloud.com/hcmUI/CandidateExperience/en/sites/CX_1/job/63859,2026-05-19 14:12
Data Quality Analyst,CBIZ,"Houston, TX, United States","May 19, 2026",https://ebez.fa.us2.oraclecloud.com/hcmUI/CandidateExperience/en/sites/CX_1/job/5411,2026-05-19 14:52
"Software Engineering - Data, Lakehouse and AI Data Platform Engineer - Associate - New York",Goldman Sachs,"New York, NY, United States","May 19, 2026",https://hdpc.fa.us2.oraclecloud.com/hcmUI/CandidateExperience/en/sites/LateralHiring/job/169285,2026-05-19 15:03
Financial Analyst,Ford Motor Company,"Dearborn, MI, United States","May 19, 2026",https://efds.fa.em5.oraclecloud.com/hcmUI/CandidateExperience/en/sites/CX_1/job/63023,2026-05-19 15:12
"Data Scientist, Manufacturing Analytics",Ford Motor Company,United States,"May 19, 2026",https://efds.fa.em5.oraclecloud.com/hcmUI/CandidateExperience/en/sites/CX_1/job/63676,2026-05-19 15:12
AI Engineer,Mortenson Construction,"Minneapolis, MN, United States","May 19, 2026",https://fa-esgu-saasfaprod1.fa.ocs.oraclecloud.com/hcmUI/CandidateExperience/en/sites/CX_1/job/22447,2026-05-19 15:33
Marketing Analyst,CooperCompanies,"Cuajimalpa de Morelos, Mexico","May 19, 2026",https://hcjy.fa.us2.oraclecloud.com/hcmUI/CandidateExperience/en/sites/CX_1/job/11237,2026-05-19 15:34
Information Security Analyst – Vulnerability & Testing Coordinator - IT Security - CBO - Full-Time - Days,The Christ Hospital Health Network,"OH, United States","May 19, 2026",https://fa-etxt-saasfaprod1.fa.ocs.oraclecloud.com/hcmUI/CandidateExperience/en/sites/CX_5/job/13484,2026-05-19 15:52
Commercial Credit Analyst I - CVL,GM Financial,"Arlington, TX, United States","May 19, 2026",https://fa-exvu-saasfaprod1.fa.ocs.oraclecloud.com/hcmUI/CandidateExperience/en/sites/CX_1/job/260155,2026-05-19 16:12
Security Analyst I,Centrus Energy,"Oak Ridge, TN, United States","May 19, 2026",https://eese.fa.us8.oraclecloud.com/hcmUI/CandidateExperience/en/sites/CentrusEnergyCareers/job/561,2026-05-19 16:33
Financial Analyst,Vertiv,"Anderson, SC, United States","May 19, 2026",https://egup.fa.us2.oraclecloud.com/hcmUI/CandidateExperience/en/sites/CX/job/20272175,2026-05-19 16:43
"GBM Private, Classic - Natural Resources, Houston, Analyst",Goldman Sachs,"Houston, TX, United States","May 19, 2026",https://hdpc.fa.us2.oraclecloud.com/hcmUI/CandidateExperience/en/sites/LateralHiring/job/173938,2026-05-19 17:33
EPIC IS Applications Analyst - Remote,Providence Health & Services,"Renton, WA, United States","May 19, 2026",https://evac.fa.us2.oraclecloud.com/hcmUI/CandidateExperience/en/sites/CX_1/job/430537,2026-05-19 17:52
