title,company,location,posted,link,found_on
Data Visualization Analyst - Flexstaff,Northwell Health,"Lake Success, Nassau, United States",Posted Today,https://eppr.fa.us2.oraclecloud.com/hcmUI/CandidateExperience/en/sites/CX_2/job/187774,2026-05-04 20:00
"Analyst, Data & Analytics",ICU Medical,"Dublin, OH, United States",Posted Today,https://eduu.fa.us2.oraclecloud.com/hcmUI/CandidateExperience/en/sites/CX_1/job/1247,2026-05-04 20:00
Supply Chain Data Analyst,Vertiv,"Westerville, OH, United States",Posted Today,https://egup.fa.us2.oraclecloud.com/hcmUI/CandidateExperience/en/sites/CX/job/20271482,2026-05-05 13:00
Data Analyst-Institute for Advanced Medicine-Aids Center Peter Krueger Clinic-Mount Sinai Health System-Full Time-Days,Mount Sinai Health System,United States,Posted Today,https://ejis.fa.us6.oraclecloud.com/hcmUI/CandidateExperience/en/sites/CX/job/3036796,2026-05-05 13:00
EA-18G Growler Mission Data Analyst,SAIC,"Oak Harbor, WA, United States",Posted Today,https://eihu.fa.us8.oraclecloud.com/hcmUI/CandidateExperience/en/sites/CX/job/2612188,2026-05-05 15:43
Data Governance Implementation Analyst for Compliance,BNY (Bank of New York Mellon),"Pittsburgh, PA, United States",Posted Today,https://eofe.fa.us2.oraclecloud.com/hcmUI/CandidateExperience/en/sites/BNY-Careers/job/71732,2026-05-05 16:12
Data Analyst - GEOINT Technical SME,SAIC,"St. Louis, MO, United States",Posted Today,https://eihu.fa.us8.oraclecloud.com/hcmUI/CandidateExperience/en/sites/CX/job/2612180,2026-05-05 19:12
Data Analyst - GEOINT Technical SME,SAIC,"Dayton, OH, United States",Posted Today,https://eihu.fa.us8.oraclecloud.com/hcmUI/CandidateExperience/en/sites/CX/job/2612192,2026-05-05 19:12
Data Analyst - GEOINT Technical SME,SAIC,"Springfield, VA, United States",Posted Today,https://eihu.fa.us8.oraclecloud.com/hcmUI/CandidateExperience/en/sites/CX/job/2612194,2026-05-05 19:12
Data Analyst - GEOINT Technical SME,SAIC,"Charlottesville, VA, United States",Posted Today,https://eihu.fa.us8.oraclecloud.com/hcmUI/CandidateExperience/en/sites/CX/job/2612193,2026-05-05 19:42
"Data Analyst, Guest Experience",IHG (InterContinental Hotels Group),"GA, United States",Posted Today,https://fa-evax-saasfaprod1.fa.ocs.oraclecloud.com/hcmUI/CandidateExperience/en/sites/CX_1001/job/162519,2026-05-05 19:42
Data Analyst,Navy Federal Credit Union,"Pensacola, FL, United States",Posted Today,https://fa-etbx-saasfaprod1.fa.ocs.oraclecloud.com/hcmUI/CandidateExperience/en/sites/nfcu/job/29971,2026-05-05 20:12
Analyst-Information Services Data Intermediate,IU Health (Indiana University Health),"Indianapolis, IN, United States",Posted Today,https://ekcm.fa.us6.oraclecloud.com/hcmUI/CandidateExperience/en/sites/CX/job/418394,2026-05-05 20:12
ERP Data Migration Analyst,UCSF (University of California San Francisco),"Brisbane, CA, United States",Posted 1 Day Ago,https://iazuqy.fa.ocs.oraclecloud.com/hcmUI/CandidateExperience/en/sites/CX_1/job/2153,2026-05-06 00:12
Analyst-Data Intermediate,IU Health (Indiana University Health),"Indianapolis, IN, United States",Posted Today,https://ekcm.fa.us6.oraclecloud.com/hcmUI/CandidateExperience/en/sites/CX/job/418254,2026-05-06 13:42
Data Analyst I - Model Management,GM Financial,"Fort Worth, TX, United States",Posted Today,https://fa-exvu-saasfaprod1.fa.ocs.oraclecloud.com/hcmUI/CandidateExperience/en/sites/CX_1/job/2194,2026-05-06 16:12
Data Analyst II - Institute for Health Equity Research,Mount Sinai Health System,United States,Posted Today,https://ejis.fa.us6.oraclecloud.com/hcmUI/CandidateExperience/en/sites/CX/job/3037624,2026-05-06 17:42
"Analyst, Data, Health Plan Operations (Supports Florida Government Contracts)",Molina Healthcare,"FL, United States",Posted Today,https://hckd.fa.us2.oraclecloud.com/hcmUI/CandidateExperience/en/sites/CX_1/job/2037296,2026-05-06 18:42
Data Analyst 3,UCSF (University of California San Francisco),"San Francisco, CA, United States",Posted Today,https://iazuqy.fa.ocs.oraclecloud.com/hcmUI/CandidateExperience/en/sites/CX_1/job/1630,2026-05-06 19:42
"Associate Analyst, Data",Molina Healthcare,"Long Beach, CA, United States",Posted Today,https://hckd.fa.us2.oraclecloud.com/hcmUI/CandidateExperience/en/sites/CX_1/job/2037113,2026-05-06 21:12
"Data Analyst- Full Time, Days, AMG Pulmonology, Summit NJ",Atlantic Health System,"Summit, NJ, United States",Posted Today,https://erqh.fa.us2.oraclecloud.com/hcmUI/CandidateExperience/en/sites/CX_1001/job/28390,2026-05-06 21:43
