title,company,location,posted,link,found_on
Data Visualization Analyst - Flexstaff,Northwell Health,"Lake Success, Nassau, United States",Posted Today,https://eppr.fa.us2.oraclecloud.com/hcmUI/CandidateExperience/en/sites/CX_2/job/187774,2026-05-04 20:00
"Analyst, Data & Analytics",ICU Medical,"Dublin, OH, United States",Posted Today,https://eduu.fa.us2.oraclecloud.com/hcmUI/CandidateExperience/en/sites/CX_1/job/1247,2026-05-04 20:00
Supply Chain Data Analyst,Vertiv,"Westerville, OH, United States",Posted Today,https://egup.fa.us2.oraclecloud.com/hcmUI/CandidateExperience/en/sites/CX/job/20271482,2026-05-05 13:00
Data Analyst-Institute for Advanced Medicine-Aids Center Peter Krueger Clinic-Mount Sinai Health System-Full Time-Days,Mount Sinai Health System,United States,Posted Today,https://ejis.fa.us6.oraclecloud.com/hcmUI/CandidateExperience/en/sites/CX/job/3036796,2026-05-05 13:00
EA-18G Growler Mission Data Analyst,SAIC,"Oak Harbor, WA, United States",Posted Today,https://eihu.fa.us8.oraclecloud.com/hcmUI/CandidateExperience/en/sites/CX/job/2612188,2026-05-05 15:43
Data Governance Implementation Analyst for Compliance,BNY (Bank of New York Mellon),"Pittsburgh, PA, United States",Posted Today,https://eofe.fa.us2.oraclecloud.com/hcmUI/CandidateExperience/en/sites/BNY-Careers/job/71732,2026-05-05 16:12
Data Analyst - GEOINT Technical SME,SAIC,"St. Louis, MO, United States",Posted Today,https://eihu.fa.us8.oraclecloud.com/hcmUI/CandidateExperience/en/sites/CX/job/2612180,2026-05-05 19:12
Data Analyst - GEOINT Technical SME,SAIC,"Dayton, OH, United States",Posted Today,https://eihu.fa.us8.oraclecloud.com/hcmUI/CandidateExperience/en/sites/CX/job/2612192,2026-05-05 19:12
Data Analyst - GEOINT Technical SME,SAIC,"Springfield, VA, United States",Posted Today,https://eihu.fa.us8.oraclecloud.com/hcmUI/CandidateExperience/en/sites/CX/job/2612194,2026-05-05 19:12
